symbol,name,sector,industry,theme,roe,operating_margin,debt_to_equity,ocf_to_net_income,revenue_growth,eps_growth,industry_momentum_6m,estimate_revision_eps,estimate_revision_revenue,relative_strength_6m,relative_strength_12m,post_earnings_reaction,avg_daily_turnover_million,pe_forward,industry_pe_forward,drawdown_from_52w,volatility_1y,red_flags,catalysts,notes,data_source,source_date
NVDA,NVIDIA,Information Technology,Semiconductors,AI infrastructure,58,54,32,1.15,61,70,22,11,8,18,42,6,1800,31,34,12,36,,New accelerator cycle; hyperscaler capex,High quality but watch valuation and export controls,SEC EDGAR + vendor consensus,2026-04-12
MSFT,Microsoft,Information Technology,Software,Cloud AI productivity,35,45,48,1.08,16,18,9,4,3,6,17,2,2200,29,31,8,22,,Azure AI monetization; Copilot adoption,Lower drama compounder; revision pace matters,SEC EDGAR + IBES,2026-04-10
CAT,Caterpillar,Industrials,Machinery,Infrastructure cycle,49,21,165,0.86,8,5,5,-2,-1,-4,6,-3,760,15,18,18,28,,Dealer inventory and commodity capex,Good business but estimates are softening,SEC EDGAR + FactSet,2026-03-30
XYZ,Example Biotech,Health Care,Biotechnology,Clinical catalyst,-18,-42,45,-0.4,0,-35,14,0,0,35,68,12,24,,42,22,82,,Phase 2 readout,Pre-profit stock needs separate high-volatility framework,Social media + forum,2026-04-20
ABC,Example Smallcap,Industrials,Specialty Manufacturing,Reshoring,11,10,95,0.74,12,13,7,6,4,11,9,4,18,17,21,26,43,,New plant utilization ramp,Interesting but liquidity blocks V1 candidate status,Exchange filing + local vendor,2026-02-15
BAD,Example RiskCo,Consumer Discretionary,Retail,Turnaround,-7,2,280,-0.2,-9,-41,-11,-15,-8,-24,-39,-18,90,24,18,55,71,监管立案; debt covenant breach,Asset sale rumor,Classic veto case: story cannot rescue financial red flags,Forum + scraped news,2026-04-05
